{
  "schemaVersion": 1,
  "outputRoot": "artifacts/converted",
  "targetProfile": "firemonkey-3.9-firefox-157.0",
  "projects": [
    {
      "id": "greasyfork-24204",
      "upstream": {
        "kind": "url",
        "url": "https://update.greasyfork.org/scripts/24204/script.user.js"
      },
      "scripts": [
        {
          "id": "greasyfork-24204",
          "sourceManager": "unknown",
          "outputPath": "greasyfork-24204.user.js",
          "identity": {
            "name": "Picviewer CE+",
            "namespace": "https://github.com/hoothin/UserScripts"
          },
          "acceptance": {
            "checklistId": "greasyfork-24204-runtime"
          },
          "publish": {
            "mode": "disabled"
          }
        }
      ]
    }
  ]
}
